{
  "user_id": "d6c3a0f1-1d46-4ab2-8a5f-3f70a38a6f00",
  "event_id": "e669d9e5-50d5-435e-a44d-5e2c876932c2",
  "registration_id": "9f4c2ba1-0a48-48c5-9b8f-514e8d0a9391",
  "registration_status": "registered",
  "event_title": "Solimouv’ Printemps 2026",
  "event_slug": "solimouv-printemps-2026",
  "event_start_date": "2026-05-21T09:00:00.000Z",
  "event_end_date": "2026-05-21T17:00:00.000Z",
  "event_location": "Paris 13e",
  "source": "event-detail",
  "sent_at": "2026-04-17T09:30:00.000Z"
}
